予算事業ID,府省庁,局・庁,事業の概要,当初予算,歳出予算現額,現状・課題,事業名,事業概要URL
1786,文化庁,,○文化芸術創造拠点形成事業／　地方公共団体における地域文化振興に係る機能強化を図るため、専門的人材を活用して実施する、地域アーティストの活動支援や地域住民やステークホルダーとの連携・協働の促進、地域文化資源を活用した文化芸術活動等の総合的な取組を支援する。／○アーティスト・イン・レジデンス型地域協働支援事業／　アーティストの創造力を活用した特色ある地域活性化を図るため、文化芸術団体等が国内外のアーティストを招へいして実施する、地域住民等と協働した創作や研究・調査、発信に係る地域滞在型の取組について支援する（R5は「アーティスト・イン・レジデンス活動支援を通じた国際文化交流促進事業」として実施し、R6より本事業に統合）。／○劇場・音楽堂等活性化・ネットワーク強化事業【令和5年度終了】／　「劇場、音楽堂等の活性化に関する法律」及び「劇場、音楽堂等の事業の活性化のための取組に関する指針」を踏まえ、我が国の劇場・音楽堂等が行う実演芸術の創造発信や専門的人材の養成、普及啓発事業等を総合的に支援することにより、我が国の劇場・音楽堂等の活性化と実演芸術の水準向上を図るとともに、地域コミュニティの創造と再生を推進し、地域の住民が質の高い芸術文化活動に触れられる環境を醸成する（R5で事業終了し、R6より別事業へ統合）。／○国際文化芸術発信拠点形成事業（先進的文化芸術創造活用拠点形成事業）【令和4年度終了】／　日本全国で開催されている芸術祭や地方の行事をコアとした文化芸術事業を充実・発展させ、民間企業を大胆に巻き込みつつ他分野との有機的な連携を図ることで世界にアピールできる我が国を代表する国際文化芸術発信拠点を形成する取組を支援する。,1102757000.0,1102757000.0,○各地域における特色ある主体的な取組を推進し、文化芸術による豊かな社会の実現を目指すためには、地方公共団体や文化芸術団体、アーティスト、地域住民等のステークホルダーが連携・協働して活力のある施策を展開することで、新たな文化芸術を創造する芽を育むソフト基盤を構築・強化していくことが重要。／○文化芸術活動の地域偏在解消のため、地方公共団体における地域文化振興に向けたさらなる機能強化やアーティストと地域住民等との協働活動に係る先進事例の蓄積と活用を相互に連携を図りながら総合的・戦略的に推進していくことが必要。,地域文化共創基盤の構築,https://www.chiikiglocal.go.jp/index.html
1823,文化庁,,史跡等に指定された地域内の土地等については、所在する遺跡等を保護するため、現状変更許可制度により規制がかけられている。国による買上げは、史跡等の保存のための土地利用制限に対し、財産権尊重のためにとられる補償的措置として行われるものであり、買上げを行うことにより、重要な遺跡として歴史的・学術的に貴重な価値を維持するばかりでなく、国民的文化遺産でもある宮跡等を保護するものである。買上げに当たっては、指定地内の土地所有者にアンケート調査等を実施し、地権者と協議に基づき必要な買上を実施するものである。,462890000.0,760786000.0,"平城宮跡の土地の買上については、明治３９年に結成された平城宮跡祉保存会の買収等の活動によって開始（大正１３年、保存会所有地を国に寄附）された。その後、昭和３７年、宮跡内での近鉄操車場建設計画が問題となった際、宮跡全体を国有地化する方針が決定され、翌年から国による買い上げ事業が開始された。／また、藤原宮跡及び飛鳥地区については、「飛鳥地方における歴史的風土及び文化財の保存等に関する施策について」（昭和４５年１２月１８日　閣議決定）によって国有地下の方針が決定された。／史跡指定地は全体で2,453,909㎡であり、令和５年度までに買上を行い国有地化された面積は、1,784,277㎡(72.7%)となっている。",平城及び飛鳥・藤原宮跡等の買上,
1900,環境省,大臣官房,意欲的な脱炭素の取組（下記１又は２）を行う地方公共団体等に対し複数年度にわたり継続的かつ包括的に支援する。／１．脱炭素先行地域づくり事業への支援／　2050年カーボンニュートラルを20年前倒しで実現を目指す脱炭素先行地域に選定された地方公共団体に対して、再エネ等設備の導入に加え、基盤インフラ設備や省CO2等設備の導入、これらと一体となってその効果を高めるために実施するソフト事業等を支援／２．重点対策加速化事業への支援／　再エネ発電設備を一定以上導入する地方公共団体に対して、地域共生再エネ等の導入や住宅の省エネ性能の向上などの重点対策の複合実施等を支援,36519631000.0,116687462000.0,2050年カーボンニュートラル及び2030年度46%削減目標の達成に向けて、第６次エネルギー基本計画（令和３年10月22日閣議決定）に基づき、電源構成で再生可能エネルギーの36-38%程度への増加が必要とされ、このうち、政策強化分として、地方公共団体主導による再エネ創出が求められた。そこで、地球温暖化対策推進法に基づく地方公共団体実行計画（事務事業編、区域施策編）の策定とともに、地域特性に応じて脱炭素事業に意欲的に取り組み、地域課題の解決にも資する取組を行う地方公共団体を集中的、重点的に支援するため、複数年度にわたって継続的かつ包括的に支援する財政制度として交付金を創設したところ。本交付金を通じたCO2削減や地域課題の解決とともに、波及効果として更なる地域脱炭素の促進が期待されている。,地域脱炭素移行・再エネ推進交付金,https://policies.env.go.jp/policy/roadmap/assets/grants/chiiki-datsutanso-kofukin-R6.pdf
2045,厚生労働省,医政局,①プログラム責任者講習会／歯科医師臨床研修のプログラム責任者を養成するために実施する講習会に必要な経費に対する補助（定額）を行う。／②臨床研修活性化推進特別事業／指導歯科医の資質向上を目的とし、指導歯科医講習会の講師の育成及び指導歯科医のフォローアップ研修を実施にかかる費用を補助（定額）を行う。,20279000.0,20279000.0,歯科医師臨床研修は、平成18年度から、従来の努力義務から必修化する形で導入された。／研修歯科医が臨床研修の到達目標を達成するためには、良質な研修プログラムと適切な指導体制の確保が重要,歯科医師臨床研修指導医講習会費,
2059,厚生労働省,医政局,以下の事業を通じて、医療機関におけるサイバーセキュリティ対策の強化を図る。／①　医療情報化人材育成事業／地域の医療機関に対し、情報化に関する助言・指導・計画の策定と実施を行うための人材を育成するため、「病院情報システムの構築方策」、「地域医療連携の確立方策」、「医療安全を考慮したシステム運用」、「システムのセキュリティとプライバシー保護」、「医療分野のＩＴ化のための目標を達成するための計画策定方策」等について研修を行っている。／②　医療分野におけるサイバーセキュリティ対策調査事業 医療機関のセキュリティ対策は、「医療情報システムの安全管理に関するガイドライン」に基づき、各医療機関が自主的に取組を進めてきているところである。昨今、国内の医療機関を標的としたランサムウェアによるサイバー攻撃被害が増加（ランサムウエアにより、長期にわたり診療が停止した複数の事例が発生）したことから、医療機関のサイバーセキュリティ対策の徹底を図る。／③医療機関におけるサイバーセキュリティ確保事業／医療機関におけるサイバーセキュリティの更なる確保のため、外部ネットワークとの接続の安全性の検証・検査や、オフライン・バックアップ体制の整備等を実施する。,100460000.0,5001070000.0,・病院などの保健医療に関わる組織・団体でデジタルトランスフォーメーション(DX)を推進することは保健医療行政において急務とされており、その実務を担当しリーダーとして活躍する人材が求められている。／・近年の医療機関を標的としたサイバー攻撃に対して、研修等を通じて平時からの対策徹底の周知や、実際に攻撃を受けた際の初動対応の支援が必要である。／・厚生労働省では医療機関に全ての外部接続ネットワーク接続点を確認することを求めているが、特に中・大規模病院は多数の部門システムで構成されているため、てのネットワーク接続を俯瞰的に把握することが重要である。／・サイバーセキュリティ事案が生じた際の速やかな復旧のためには、オフライン・バックアップが有効であり、医療機関においてオフライン・バックアップ環境を整備することが重要である。,医療情報セキュリティ等対策経費,https://www.mhlw.go.jp/stf/seisakunitsuite/bunya/kenkou_iryou/iryou/johoka/cyber-security.html
2064,厚生労働省,医政局,毎年11月25日を含む１週間に実施される医療安全推進週間の普及啓発を行う。,2695000.0,2695000.0,「患者の安全を守るための共同行動（PSA）」の一環として、平成13年度から11月25日（いい医療に向かってGO）を含む１週間を「医療安全推進週間」と位置づけている。当該事業では各厚生（支）局において医療従事者を対象としたワークショップ開催と国民への普及啓発のためのポスター作成を行っている。医療安全関連の講演会等を行うことで医療従事者だけでなく、国民へも医療安全への理解を深める活動を引き続き実施し医療安全への更なる意識の向上に努める必要がある。,患者安全推進（ＰＳＡ）事業,
2154,厚生労働省,健康・生活衛生局,①ハンセン病療養所退所者に対して、退所者給与金を支給。／②裁判上の和解が成立したハンセン病療養所非入所者に対して非入所者給与金を支給。／③ハンセン病療養所退所者給与金の受給者の遺族に対して支援金を支給。,2295147000.0,2295147000.0,ハンセン病問題の解決の促進に関する法律第１５条に基づき、ハンセン病療養所退所者給与金、ハンセン病療養所非入所者給与金及び特定配偶者等支援金を支給しているところであるが、受給者の高齢化に伴い、隔月ごとの申請手続を行うことが困難なケースも散見されるようになっている。そのため、受給者の請求手続をサポートする体制の強化が求められている。,退所者等対策経費,
2157,厚生労働省,健康・生活衛生局,①ハンセン病に関する討論会、ハンセン病講座の開催、地域啓発の促進、国立ハンセン病資料館の運営。／②ハンセン病療養所入所者の社会復帰者の支援。／③沖縄県におけるハンセン病の外来診療所への財政支援、社会復帰者への自立助長、ハンセン病に関する知識の啓発普及。／④ハンセン病問題に関する検証会議最終報告書の提言を検討し、その検討結果を活用するための施策の実施状況等の検討。,872554000.0,875955000.0,ハンセン病問題の解決の促進に関する法律に基づき、ハンセン病の患者であった者等の福祉の増進を図ることを基本とし、入所者対策、普及啓発対策、社会復帰支援対策等の施策を推進しているところであるが、特に、当時の体験などを後世に語りつなげることが重要な課題となっている。しかしながら、入所者や元患者の方々の高齢化により、貴重な証言を記録する時間は、わずかしか残されていない。同様に、高齢化により、社会生活に支障が出ている方々のための相談体制の強化が求められている。,ハンセン病対策事業委託費,
2224,厚生労働省,医薬局,①エイズ患者遺族等相談事業、ヤコブ病サポートネットワーク事業、ヤコブ病サポートネットワーク事業（補助率10/10）／　血液製剤によるHIV感染により家族を亡くした遺族等のための相談や相談員を対象とした研修を行う。ヒト乾燥硬膜の移植によりクロイツフェルト･ヤコブ病を発症し家族を亡くした遺族等のための相談や相談員を対象とした研修会等を行う。／②サリドマイド被害者生活支援等事業（補助率10/10）／医療･介護等に専門的な知識を有する相談員がサリドマイド被害者に対する訪問調査を行い、日常生活上の問題点へのアドバイスなどを実施する。,160696000.0,160696000.0,"令和3年度のエイズ患者遺族等及びヤコブ患者遺族等相談事業における相談件数は4,579件、サリドマイド被害者生活支援等事業における相談件数は3,553件であった。／被害者を看取ってきた遺族も高齢化や孤立化のため困難が増してきている。薬害による偏見を恐れて地域との関係を断ってきた多くの遺族は周囲に話しができる人もおらず、一人で悲しみを抱え孤立している人も少なくない。／そこで、多様な支援ニーズ等に応じたきめ細やかな対応ができる総合的な相談支援体制の整備に努めていく必要がある。",エイズ患者遺族等相談事業,
2262,厚生労働省,医政局,医療法第２５条第３項に基づく立入検査については、厚生労働大臣の承認を得た臨床研究中核病院の各施設に赴き、法令により定められている人員及び構造設備等を有し、適正な管理が行われているかを検査し、不適切な場合は指導等を通じ改善を図る。,802000.0,802000.0,令和６年４月時点で臨床研究中核病院は15施設となる（令和５年４月10日に１施設追加）,臨床研究実施体制確保対策費,https://www.mhlw.go.jp/stf/seisakunitsuite/bunya/tyukaku.html
2308,厚生労働省,保険局,高額な医薬品や医療機器について、それらの医療技術の効率性(費用対効果）について精緻に評価を行い、償還価格について検討を行う。また、中医協等に報告するための先行する欧米等の諸外国における費用対効果評価の現状等の調査や、費用対効果評価の専門的知識や技術を有する人材が国立保健医療科学院のみならず、製造販売業者やアカデミア等においても不足していることを鑑みて、費用対効果評価制度の発展に貢献しうる専門人材育成の取り組みを行う。,967632000.0,967632000.0,我が国においては、諸外国と比べて費用対効果評価の導入が遅れたため、費用対効果評価で使用するための疫学データ、費用やQOLデータの蓄積が不十分である。我が国の現状や国民性を反映させた費用対効果評価を実施するためには、それらのデータの収集･蓄積が課題となっている。,医療技術の費用対効果を評価するために必要な経費,
2365,厚生労働省,健康・生活衛生局,輸入食品の安全性確保については、食品安全基本法第6条において国の責務として定められるとともに、第10条において法制上、財政上必要な措置を講じることとされている。／これに従い、厚生労働省においては、食品衛生法第23条の規定に基づき、毎年度「輸入食品監視指導計画」をパブリックコメント実施の上策定し、必要な検査項目、検査件数等を定め検疫所における検査を実施している。,1878623000.0,2652949000.0,"本事業は、日本人の食事の約6割（カロリーベース）を占める、輸入食品の安全性を水際で確保するものであり、広く国民のニーズがあり、国費を投入して実施すべき必要な事業である。また、輸入食品の安全を確保するためには、全国均一に実施する必要があり、国が実施するべき事業である。調達案件について、幅広に一般競争入札を実施するとともに、少額随意契約による場合であっても複数者から見積を徴取し、最低価格の者と契約を締結する等、競争性を確保している。令和５年度の輸入届出件数は速報値で約235万件、モニタリング検査は計画数100,109件に対し、速報値で延べ101,096件を実施した。令和６年度においては、モニタリング検査は100,224件計画している。届出数が年々増加している中、輸入食品の安全性を確保するため、必要な検査数を確実に実施しなければならない。",輸入食品の検査に必要な事業,https://www.mhlw.go.jp/stf/seisakunitsuite/bunya/kenkou_iryou/shokuhin/yunyu_kanshi/index.html
2800,厚生労働省,年金局,国庫負担金等を財源として、特別障害給付金の給付を行う。,2407483000.0,2407483000.0,特別障害給付金受給者に対し、特別障害給付金の給付を着実に行っている。今後とも、給付費の支払いに支障をきたさぬように、支払実績等を踏まえ必要な予算額を確保するとともに、適正な執行を行うなどの取組を進める必要がある。,特別障害給付金給付に必要な経費,https://www.mhlw.go.jp/stf/seisakunitsuite/bunya/hukushi_kaigo/shougaishahukushi/kyuhukin/index.html
2956,厚生労働省,大臣官房,各研究事業毎に評価委員会を設置し、研究開発課題の採択に関する事前評価、研究の進捗を評価する中間評価、研究が適切に行われたか等を評価する事後評価を実施する等、厚生労働科学研究費補助金等の各研究事業が適切かつ効果的に実施されるための事業を実施している。,48097000.0,47997000.0,厚生労働科学研究費補助金による研究事業等の公的に行われる研究について、適切に評価し、戦略性のある効率的な費用配分と適正な研究事業運営を確保して必要な研究を推進するため、「厚生労働省の研究助成等の在り方に関する省内検討会」において、評価の適切性や政策への連動性、効率・適正な運営等の確保の観点等から検討が行われ、「研究助成の改善等に向けた基本的な方向性について」（平成22年7月29日厚生労働省省内検討会報告書）（以下、「検討会報告書」という。）が取りまとめられている。大綱的指針及び検討会報告書を踏まえて、厚生労働省の科学研究開発（試験、調査等を含む。）に関する研究開発プログラム、研究開発課題、研究開発機関及び研究者の業績の評価について、個人情報保護の観点に配慮しつつ、外部評価の実施、国際的な視点からの評価の実施、評価結果の公開、研究費等の研究開発資源の配分への適切な反映等を行うことにより、研究開発評価の一層、適切かつ効果的な実施を図ることが必要であり、各研究事業毎に評価委員会を設置し、研究開発課題の採択に関する事前評価、研究の進捗を評価する中間評価、研究が適切に行われたか等を評価する事後評価を実施する等、厚生労働科学研究費補助金等の各研究事業が適切かつ効果的に実施されるための事業を実施しており、引き続き各事業毎に研究開発課題の評価を行う必要がある。,研究評価推進事業費,
3330,水産庁,,水産機構が中長期目標に基づき作成した中長期計画及び年度計画に掲げる、①水産業の持続可能な発展のための水産資源に関する研究開発、②水産業の持続可能な発展のための生産技術に関する研究開発、③漁業、養殖業のための新たな生産技術定着のための開発調査、④水産業界を担う人材の育成等を実施するために必要な資金の交付及び効率的かつ効果的な研究を推進する上で必要な施設の整備・改修並びに漁業調査船の代船建造に要する経費を補助。（定額補助）,17061694000.0,22549426000.0,我が国においては、漁船の高船齢化、漁業者の減少・高齢化の進行など水産物の生産体制が脆弱化するとともに、水産資源の減少等により生産量が減少傾向にある。／このような状況の中で、水産資源の適切な管理と水産業の成長産業化を両立させ、漁業者の所得向上と年齢バランスのとれた漁業就業構造を確立することを目指し、新たな漁業法における水産資源調査・評価の高度化、輸出拡大にも寄与する漁業・養殖業の発展のための研究開発、気候変動、不漁問題への対応、漁業就業者の減少を見据えた生産性の向上、人材育成などの課題に対して優れた研究開発成果等を生み出し、水産資源の適切な管理、水産業の成長産業化等の施策実現や「みどりの食料システム戦略」を推進する必要がある。,国立研究開発法人水産研究・教育機構に要する経費,
3443,林野庁,,本事業は、「森林･林業基本計画」に即した重点施策の内容や当庁の取組状況などについて情報誌「林野」に掲載し、計画の推進状況等を広く国民に周知するものである。／・職員等が執筆した原稿を基に、情報誌を編集し、版下を製作する。／・製作した版下をPDFファイルにし、林野庁のウェブサイトに掲載するとともに、SNS等で広報する。／・製作した版下を印刷し、多数の来場者が想定され、閲覧による2次利用が期待できる図書館等のほか、地方公共団体、報道関係者、教育関係者、国有林モニター等へ発送、配布する。／注：図書館利用者や国有林モニターには、パソコンを持たず、電子媒体では情報を入手する手段がない高齢者なども多いため、印刷物の配布は不可欠である。,12236000.0,12236000.0,国土の約7割を占める森林は、国土の保全、水源の涵養、地球温暖化の防止、生物多様性の保全、景観・文化の形成など重要な役割を担っているが、森林・林業に関する施策は、一般に人口の少ない山間地域で実施されており、国民にとって馴染みが薄く、また専門的で分かりにくいと考えられている。このため、施策対象の森林・林業・木材産業関係者はもとより、木材の消費者ともなる一般国民に対し、いかに林野庁の施策情報を分かりやすい表現で、広報し、理解を得るかが課題となっている。／　広報活動としては、報道機関に対するプレスリリース、ホームページによる情報提供のほか、紙媒体の情報紙「林野」の発行・配布を行うほか、それらの情報をFacebook、X（旧Twitter）などのSNSで積極的に発信していく必要がある。,林野庁情報誌「林野」に必要な経費,
3584,経済産業省,商務情報政策局商務・サービスG,国際博覧会条約第32条の規定（分担金の割当て）に基づき、BIE総会で決定された分担金を拠出する。,8583000.0,8583000.0,国際博覧会条約第32条の規定（分担金の割当て）に基づき、BIE総会で決定された分担金を拠出する。,博覧会国際事務局（BIE）分担金,https://www.meti.go.jp/main/yosan/yosan_fy2023/pr/ip/shosa_09.pdf
