予算事業ID,府省庁,局・庁,事業の概要,当初予算,歳出予算現額,現状・課題,事業名,事業概要URL
7382,厚生労働省,老健局,認知症のVR疑似体験、認知症を正しく理解するための展示、認知症希望大使の活動や共生社会を推進する動画、認知症研究の最新情報の紹介や近年の施策の動向が分かる動画、認知症サポーター講座やチームオレンジの活動状況がわかる動画 など様々な取組みを検討する。／なお、認知症を正しく理解するための展示として、日本と諸外国の認知症（施策）の歴史をひもとくため、各時代で認知症の人を診察していた医師、地域の保健師、認知症の人の家族等の関係者への取材等を通じて、その証言や関係者が所有している写真等を収集するなどを検討している。,23471000.0,67830000.0,現在、認知症はだれもがなりうるものであり、家族や身近な人が認知症になることなどを含め、多くの人にとって身近なものとなっている。また、認知症の発症を遅らせ、認知症になっても希望を持って日常生活を過ごせる社会を目指し、認知症の人や家族の視点を重視しながら、「共生」と「予防」を車の両輪として施策を推進している。,大阪・関西万博における認知症に関する情報発信事業,
7440,国土交通省,大臣官房,ICT施工StageⅡとして、工事全体の「見える化」による建設現場の即時的な工程改善、作業と監督検査の効率化等を図り、それぞれの現場での試行を通じて各種データの仕様策定、既存の監督検査に係る基準改定等を実施する。,30000000.0,30000000.0,建設現場での効率化を行うため、測量・設計/施工計画・施工・検査、それぞれの工程においてICT（情報通信技術）を活用する「ICT施工」に取り組んできているが、少子高齢化等の社会的課題が表面化してきており、更なるステップアップが必要である。,施工データの高度利用による建設現場の最適化検討,
7525,防衛省,防衛装備庁,当該事業では、令和3年度から令和5年度にかけて「EMP弾用電源技術の研究」で弾頭部に適用可能で連続照射可能な電気エネルギー方式の電源部要素、「爆薬発電技術の研究」で高出力化が見込まれる火薬エネルギー方式の電源部要素、「高出力放射技術の研究」で高出力のEMPを放射可能な放射部要素に関する技術資料を得て、令和5年度に「敷設型EMP装備の研究」で前述の要素研究の成果を組み合わせたEMP発生部により技術資料を得る。また、将来EMP装備適用技術について、令和6年度から令和10年度にかけて研究試作を実施し、令和7年度～令和10年度まで所内試験を実施する。,271561000.0,271561000.0,EMP弾に適用可能な技術分野については、米国を中心に研究開発が進むも、技術的優勢確保の観点から各国とも極めて限定した情報しか出しておらず、また市場からの直接入手も困難な状況にある。また、国内においては車両や家電製品等に対する電磁的影響を検査するための設備としての運用例はあるもののロケット弾等に搭載可能な小型・高出力化を追求したものではなく、EMP弾等の限られた容積に格納するためには小型化・高出力化について、研究を行う必要がある。,ＥＭＰ装備に関する研究,
7773,農林水産省,農産局,計画的に省エネルギー化等に取り組む産地を対象に、農業者と国が資金を設け、燃油・ガスの価格が一定の基準を超えた場合に補填金を交付するセーフティネット対策を講じる。　／　（基金に関する事項）／　基金設置年度：平成24年度／　運用形態：取崩型／　事業形態：補塡,0.0,2880000000.0,近年、冬期の加温等に使用される燃料価格は、為替や国際的な商品市況によって大きく変動しており、経営費に占める燃料費の割合が高い施設園芸及び茶農家の経営に影響を及ぼしている。施設園芸においては、燃料高騰の影響を受けにくい経営への転換に加え、みどりの食料システム戦略の推進に向け、「化石燃料のみに依存しない施設への経営転換」が重要であるが、現状は10％程度と足踏みをしている状態。,施設園芸等燃料価格高騰対策,https://www.maff.go.jp/j/seisan/ryutu/engei/nenyu/nenyu_taisaku1.html
19649,林野庁,,花粉の飛散量の予測に資するため、スギ雄花の花芽調査等を進めるとともに、林野庁が実施する花粉症対策の普及啓発等を実施。,39237000.0,39237000.0,"花粉症対策については、これまで進めてきた対策により、花粉の少ないスギ苗木の生産量は 10 年前の約 140 万本から 10 倍の約 1,500 万本へと飛躍的に伸び、全スギ苗木の生産本数のうち約５割を占めるまでに増加している。しかしながら、花粉の少ないスギ苗木の更なる生産拡大を進めるとともに、伐採･植替えを推進するためには、森林所有者への理解の醸成等が必要。",花粉の少ない森林への転換促進対策,https://www.rinya.maff.go.jp/j/rinsei/yosankesan/attach/pdf/R6_kettei_hikou-24.pdf
19879,厚生労働省,医薬局,電子処方箋の利活用・普及を促進するため、導入済の施設等から得られた課題等の情報を整理し、実情を踏まえた医療機関・薬局に対する普及方策や国民に向けた効果的周知広報を実施する。,0.0,792809000.0,電子処方箋は、令和5年1月に全国で運用を開始したが、医療機関・薬局において利活用・普及が十分に進んでいない状況にある。課題として、医療機関・薬局、患者等が電子処方箋の仕組みやメリット等を十分に認識していないことが挙げられるため、医療機関・薬局、患者等に応じた効果的な周知広報を実施する必要がある。,電子処方箋の普及拡大事業,https://www.mhlw.go.jp/stf/denshishohousen.html
20138,総務省,国際戦略局,通信事業者にとどまらずユースケースを有する利用者が、製品化・サービス化に向けた実証ができる環境としてオール光ネットワークの実証基盤環境を段階的に構築するため、簡易的なオール光ネットワーク環境の構築を通じて、 2030年度頃のオール光ネットワークの社会実装に向けた実証基盤環境の運用の在り方等に関する知見を抽出する。,0.0,400000000.0,2022年秋の臨時国会における「国立研究開発法人情報通信研究機構法及び電波法の一部を改正する法律（令和４年法律第 93 号）」の成立により、2023 年３月、国立研究開発法人 情報通信研究機構（以下、「NICT」という。）に革新的な情報通信技術の研究開発のための恒久的な基金（以下、「基金」という。）が設置され、我が国発の技術を確立し、社会実装や海外展開を目指す研究開発が進められている。こうした研究開発を通して、我が国が他国に先駆けたオール光ネットワークを活用した社会課題の解決をするためのユースケースが実装された社会を目指す観点からは、これらの開発成果が揃うことを待つことなく、できるだけ早期にユースケースを有する又は今後有すると想定される利用者が実際に製品化の確認・検証をできる環境の整備が必要となっている。,オール光ネットワーク技術開発の促進及び普及・拡大,
20947,厚生労働省,大臣官房,①　医療記録等の保存に関する取組／　事件に関連する医療記録の電子化、保存を行う。各医療機関と協議の上、電子カルテまたは外部ハードディスク等へ保存し、廃棄が進まない体制を確立する。／②　オーラルヒストリー聴取に関する取組／　診療にあたった医療従事者等の事件関係者に、当時の体験から得られる教訓等の情報を聴取する。,0.0,4416000.0,地下鉄サリン事件から約３０年が経過し、カルテを始めとした当時の医療記録は散逸が進んでいる。また、事件関係者の高齢化により、体験から得られる教訓等の情報が失われつつある。,サリン事件の救護・医療記録等のアーカイブ事業,
20971,総務省,自治行政局,地方公共団体が保有する情報システムに対して、情報システム内部への侵入可否及び侵入後の被害想定を把握すべく、攻撃者が実際に行う最新の攻撃手法を用いて客観的に検証するペネトレーションテストを実施しすることで、セキュリティ対策上の問題点について評価及び助言等を行い、地方公共団体全体の情報セキュリティ水準を向上させる。／また、実施した地方公共団体における調査結果やセキュリティ対策の手法等を他の地方公共団体にも横展開を行うことで地方公共団体全体のセキュリティ対策のレベルを底上げする。,0.0,193655000.0,地方公共団体が保有する情報システムにおけるセキュリティ対策について、情報システム内部への侵入可否及び侵入後の被害想定を把握まで対応できないケースもあり、地方公共団体におけるペネトレーションテストの実施は普及していない。,自治体向けペネトレーションテスト実証事業,
21043,厚生労働省,社会・援護局,文献調査や自治体・ベンダ・事業者団体等への実態調査を行うことで事業者・自治体間の障害福祉関係手続及び関係するシステムの洗い出しを行い、その内容・機能や相互の関係性を明らかにするとともに、システム共通化の検討の対象範囲や課題の検討を行う。その上で、各手続の標準的な業務プロセスを検討し、事務フロー・データフロー（事務フロー間のデータの流れ）・データセット・マスタ（各種業務の判断ロジック）の案を作成する。／また、本システムの対象とする範囲を確定して要件定義をした上で、システムの調達に向けた仕様書や要件定義書等を作成する。,0.0,88000000.0,障害のある方々に障害福祉サービス等を提供する事業者は、障害者総合支援法に基づき、都道府県等から指定を受けるための申請を含む各種申請・届出等の手続を行う必要がある。現在、その手続は、事業者が紙の書類を対面で都道府県等に申請し、都道府県等は紙の書類に基づき、事業所情報をそれぞれ独自の事業所台帳管理システムに入力し、事業所の管理を行っていることが多い。／また、事業所情報を管理する事業所台帳管理システムを都道府県等において整備しているが、３年に一度行われる報酬改定や、その他の改正制度の都度、求められる基礎資料が変わることから、事業所台帳管理システムの改修が必要となり、都道府県等の負担となっている,事業者・自治体間の障害福祉関係手続の共通化に向けた調査・要件定義等委託事業,
